{
  "scoring": {
    "base_score": 100,
    "syllable_penalty": 20,
    "syllable_threshold": 3,
    "length_penalty": 2
  },
  "keyword_categories": {
    "diving_primary": {
      "words": ["scuba", "dive", "diver", "diving"],
      "bonus": 25
    },
    "ocean_terms": {
      "words": ["ocean", "marine", "aqua", "underwater", "sea"],
      "bonus": 20
    },
    "reef_related": {
      "words": ["reef", "coral", "fish"],
      "bonus": 18
    },
    "action_words": {
      "words": ["explore", "track", "find", "spot", "map", "guide", "scout"],
      "bonus": 15
    },
    "location_terms": {
      "words": ["spot", "site", "location", "destination"],
      "bonus": 12
    },
    "tech_terms": {
      "words": ["log", "data", "cam", "pix", "app"],
      "bonus": 10
    },
    "community": {
      "words": ["buddy", "crew", "community", "club"],
      "bonus": 10
    },
    "business": {
      "words": ["shop", "rental", "school", "instructor", "lesson"],
      "bonus": 8
    }
  },
  "special_combinations": [
    {
      "primary": "dive",
      "secondary": ["spot", "site", "log", "tracker", "buddy"],
      "bonus": 30
    },
    {
      "primary": "scuba",
      "secondary": ["guide", "trip", "shop", "lesson", "tracker"],
      "bonus": 30
    },
    {
      "primary": "reef",
      "secondary": ["explorer", "watcher", "cam", "guide", "map"],
      "bonus": 25
    },
    {
      "primary": "ocean",
      "secondary": ["explorer", "adventure", "journey", "conserve"],
      "bonus": 20
    }
  ],
  "penalties": {
    "hard_to_pronounce": {
      "patterns": ["xq", "zx", "qz", "xz", "qw", "wx"],
      "penalty": 50
    },
    "too_generic": {
      "patterns": ["website", "online", "web", "net", "site"],
      "penalty": 20
    }
  }
}